file,keywords,description,queries
data/bpmn/Klachten-Kortemark.bpmn,"['Klachtenproces', 'Klachtencoördinator', 'Medewerker dienst', 'Klacht registreren', 'Webformulier', 'Melding', 'Klachtenbehandelaar', 'Ontvankelijkheid', 'Evaluatie', 'Verslag', 'Antwoord op klacht', 'Klachtenregister', 'e-bestuur', 'College van burgemeester en schepenen']","Het proces beschrijft de stappen die worden gevolgd wanneer een klacht of melding wordt ingediend bij een gemeentelijke dienst. Het begint met de vraag of het om een melding of klacht gaat, gevolgd door de registratie van de klacht en de beoordeling van de ontvankelijkheid. Afhankelijk van de aard van de klacht wordt deze toegewezen aan de juiste klachtenbehandelaar. Er zijn verschillende routes afhankelijk van tegen wie de klacht gericht is. Het proces omvat ook de evaluatie van de klacht, het opmaken van een verslag en het communiceren van het antwoord naar de melder binnen gestelde termijnen.","[{'query': 'Klachtenproces gemeente', 'language': 'Dutch'}, {'query': 'Municipal complaint process', 'language': 'English'}, {'query': 'Processus de plainte municipal', 'language': 'French'}, {'query': 'Registratie klachten in e-bestuur', 'language': 'Dutch'}, {'query': 'Registration of complaints in e-governance', 'language': 'English'}, {'query': ""Enregistrement des plaintes dans l'e-gouvernance"", 'language': 'French'}, {'query': 'Rol van klachtencoördinator', 'language': 'Dutch'}, {'query': 'Role of complaint coordinator', 'language': 'English'}, {'query': 'Rôle du coordinateur des plaintes', 'language': 'French'}, {'query': 'Behandeling klachten door college van burgemeester en schepenen', 'language': 'Dutch'}, {'query': 'Handling complaints by the college of mayor and aldermen', 'language': 'English'}, {'query': 'Traitement des plaintes par le collège des bourgmestre et échevins', 'language': 'French'}, {'query': 'Antwoordtermijnen op klachten', 'language': 'Dutch'}, {'query': 'Response times for complaints', 'language': 'English'}, {'query': 'Délais de réponse aux plaintes', 'language': 'French'}, {'query': 'Indienen klacht via webformulier', 'language': 'Dutch'}, {'query': 'Submitting a complaint via web form', 'language': 'English'}, {'query': 'Soumettre une plainte via un formulaire web', 'language': 'French'}, {'query': 'Verslaglegging in klachtenproces', 'language': 'Dutch'}, {'query': 'Reporting in the complaint process', 'language': 'English'}, {'query': 'Rapportage dans le processus de plainte', 'language': 'French'}, {'query': 'Ontvankelijkheid van klachten', 'language': 'Dutch'}, {'query': 'Admissibility of complaints', 'language': 'English'}, {'query': 'Recevabilité des plaintes', 'language': 'French'}]"
data/bpmn/klachtenbehandeling.bpmn,"['klachtenbehandeling', 'burger', 'gemeentebestuur', 'klacht indienen', 'gegrondheid', 'klachtenformulier', 'melding', 'CRM', 'OCMW', 'milieuklacht', 'organisatiebeheersing', 'kwaliteit', 'wachtrij', 'ontvangstbevestiging', 'ontvankelijkheid', 'beroepsprocedure', 'klachtendossier', 'motivatie cel', 'antwoordbrief', 'verbetering', 'ombudsdienst']","Het proces beschrijft de behandeling van klachten door een gemeentebestuur. Burgers kunnen klachten indienen via e-mail of een digitaal formulier. Klachten kunnen betrekking hebben op gemeentelijke dienstverlening of schade aan de openbare ruimte. De klachten worden geregistreerd in een CRM-systeem en dagelijks behandeld door de cel Organisatiebeheersing. Er wordt onderscheid gemaakt tussen verschillende soorten klachten zoals informatievragen, beroepsprocedures, meldingen en milieuklachten. Elke klacht wordt geëvalueerd op ontvankelijkheid en vervolgens onderzocht. De burger ontvangt een ontvangstbevestiging en uiteindelijk een antwoordbrief met de uitkomst van het onderzoek. Indien de burger niet tevreden is, kan deze zich wenden tot de ombudsdienst.","[{'query': 'proces van klachtenbehandeling bij een gemeente', 'language': 'Dutch'}, {'query': 'municipal complaint handling process', 'language': 'English'}, {'query': 'processus de gestion des plaintes municipales', 'language': 'French'}, {'query': 'indienen van een klacht via gemeentelijke website', 'language': 'Dutch'}, {'query': 'submitting a complaint via municipal website', 'language': 'English'}, {'query': 'soumettre une plainte via le site web municipal', 'language': 'French'}, {'query': 'gebruik van CRM in klachtenbehandelingsproces', 'language': 'Dutch'}, {'query': 'use of CRM in complaint handling process', 'language': 'English'}, {'query': 'utilisation de CRM dans le processus de traitement des plaintes', 'language': 'French'}, {'query': 'onderscheid tussen klacht en melding', 'language': 'Dutch'}, {'query': 'distinction between complaint and report', 'language': 'English'}, {'query': 'distinction entre plainte et signalement', 'language': 'French'}, {'query': 'rol van cel Organisatiebeheersing in klachtenafhandeling', 'language': 'Dutch'}, {'query': 'role of Organization Management cell in complaint resolution', 'language': 'English'}, {'query': 'rôle de la cellule de gestion organisationnelle dans la résolution des plaintes', 'language': 'French'}, {'query': 'ontvangstbevestiging van klacht naar burger', 'language': 'Dutch'}, {'query': 'acknowledgment of receipt of complaint to citizen', 'language': 'English'}, {'query': 'accusé de réception de plainte au citoyen', 'language': 'French'}, {'query': 'behandeling van milieuklachten door gemeente', 'language': 'Dutch'}, {'query': 'handling of environmental complaints by municipality', 'language': 'English'}, {'query': 'traitement des plaintes environnementales par la municipalité', 'language': 'French'}, {'query': 'doorlooptijd en rapportage van klachten', 'language': 'Dutch'}, {'query': 'turnaround time and reporting of complaints', 'language': 'English'}, {'query': 'délai de traitement et rapport des plaintes', 'language': 'French'}, {'query': 'procedure bij niet ontvankelijke klacht', 'language': 'Dutch'}, {'query': 'procedure for inadmissible complaint', 'language': 'English'}, {'query': 'procédure pour plainte irrecevable', 'language': 'French'}, {'query': 'doorverwijzing naar ombudsdienst bij ontevredenheid', 'language': 'Dutch'}, {'query': 'referral to ombudsman service in case of dissatisfaction', 'language': 'English'}, {'query': ""orientation vers le service de médiation en cas d'insatisfaction"", 'language': 'French'}, {'query': 'opstellen van een antwoordbrief na klachtenonderzoek', 'language': 'Dutch'}, {'query': 'drafting a response letter after complaint investigation', 'language': 'English'}, {'query': ""rédaction d'une lettre de réponse après enquête sur les plaintes"", 'language': 'French'}]"
data/bpmn/Meldingen-Heuvelland.bpmn,"['Meldingen', 'Heuvelland', 'Onthaal', 'Evaluatie', 'Telefoon', 'Mail', 'Doorverbinden', 'Notitie', 'Werkopdracht', 'Communicatie', 'Burger', 'Uitvoering', 'Facebook', 'Website', 'superNode']","Het proces beschrijft de afhandeling van meldingen in Heuvelland. Het begint bij het onthaal waar meldingen via telefoon, mail of Facebook binnenkomen. Deze meldingen worden geëvalueerd en indien nodig doorverbonden naar de specifieke dienst. Er wordt een notitie gemaakt van de melding en het telefoonnummer van de melder. Als een werkopdracht nodig is, wordt deze gemaakt en gecommuniceerd naar de burger. De uitvoering van de werkopdracht wordt gevolgd door een afsluiting. Er zijn ook stappen voor het evalueren van meldingen en het opvragen van de status via Facebook.","[{'query': 'Procesafhandeling meldingen gemeente Heuvelland', 'language': 'Dutch'}, {'query': 'Handling of notifications in Heuvelland municipality', 'language': 'English'}, {'query': 'Traitement des notifications dans la municipalité de Heuvelland', 'language': 'French'}, {'query': 'Evaluatie en doorverbinden van telefoonmeldingen', 'language': 'Dutch'}, {'query': 'Evaluation and forwarding of telephone notifications', 'language': 'English'}, {'query': 'Évaluation et transfert des notifications téléphoniques', 'language': 'French'}, {'query': 'Communicatieproces naar burger bij meldingen', 'language': 'Dutch'}, {'query': 'Communication process to citizens regarding notifications', 'language': 'English'}, {'query': 'Processus de communication aux citoyens concernant les notifications', 'language': 'French'}, {'query': 'Werkopdracht aanmaken en uitvoeren in BPMN', 'language': 'Dutch'}, {'query': 'Creation and execution of work orders in BPMN', 'language': 'English'}, {'query': 'Création et exécution des ordres de travail dans BPMN', 'language': 'French'}, {'query': 'Afhandeling van meldingen via Facebook in BPMN', 'language': 'Dutch'}, {'query': 'Handling of notifications via Facebook in BPMN', 'language': 'English'}, {'query': 'Gestion des notifications via Facebook dans BPMN', 'language': 'French'}, {'query': 'Gebruik van superNode in BPMN proces', 'language': 'Dutch'}, {'query': 'Use of superNode in BPMN process', 'language': 'English'}, {'query': 'Utilisation de superNode dans le processus BPMN', 'language': 'French'}, {'query': 'Meldingsformulier invullen op website Heuvelland', 'language': 'Dutch'}, {'query': 'Filling out notification form on Heuvelland website', 'language': 'English'}, {'query': 'Remplir le formulaire de notification sur le site web de Heuvelland', 'language': 'French'}, {'query': 'Periodieke evaluatie van Facebook berichten in BPMN', 'language': 'Dutch'}, {'query': 'Periodic evaluation of Facebook messages in BPMN', 'language': 'English'}, {'query': 'Évaluation périodique des messages Facebook dans BPMN', 'language': 'French'}, {'query': 'Telefonische meldingen doorverbinden naar dienst', 'language': 'Dutch'}, {'query': 'Forwarding telephone notifications to service department', 'language': 'English'}, {'query': 'Transfert des notifications téléphoniques au service compétent', 'language': 'French'}]"
data/bpmn/Meldingen-Kortemark.bpmn,"['Meldingen', 'Kortemark', 'Meldingsformulier', 'Telefoon', 'Mail', 'Loket', 'Evaluatie', '3P', 'Omgevingsloket', 'Coördinator', 'Afdelingshoofd', 'Uitvoerende dienst', 'Externe aannemer', 'Schepencollege', 'CBS', 'Werkopdracht', 'Nazicht', 'Uitbesteding', 'Burgemeester', 'Schepenen', 'superNode']","Het proces beschrijft de stappen die gevolgd worden bij het ontvangen en afhandelen van meldingen in Kortemark. Het begint met het invullen van een meldingsformulier op de website, of contact via telefoon, mail of aan het loket. Vervolgens wordt de melding geëvalueerd en geregistreerd in een systeem genaamd 3P. Er wordt bepaald of de melding voor een andere instantie is en of deze al bestaat. Afhankelijk van de evaluatie wordt de melding doorgegeven aan de juiste instantie of wordt er een werkopdracht gecreëerd en uitgevoerd, hetzij intern of door een externe aannemer. Het proces omvat ook de communicatie naar de melder over de status van de melding en de uitvoering van de werkopdracht.","[{'query': 'Meldingsproces gemeente Kortemark', 'language': 'Dutch'}, {'query': 'Reporting process municipality of Kortemark', 'language': 'English'}, {'query': 'Processus de signalement commune de Kortemark', 'language': 'French'}, {'query': 'Evaluatie meldingssysteem 3P', 'language': 'Dutch'}, {'query': 'Evaluation of reporting system 3P', 'language': 'English'}, {'query': 'Évaluation du système de signalement 3P', 'language': 'French'}, {'query': 'Werkopdracht afhandeling na melding', 'language': 'Dutch'}, {'query': 'Work order processing after report', 'language': 'English'}, {'query': ""Traitement de l'ordre de travail après signalement"", 'language': 'French'}, {'query': 'Communicatieproces met melder Kortemark', 'language': 'Dutch'}, {'query': 'Communication process with reporter Kortemark', 'language': 'English'}, {'query': 'Processus de communication avec le signalant Kortemark', 'language': 'French'}, {'query': 'Doorsturen melding naar andere instantie', 'language': 'Dutch'}, {'query': 'Forwarding report to another authority', 'language': 'English'}, {'query': 'Transfert du signalement à une autre autorité', 'language': 'French'}, {'query': 'Uitvoering werkopdracht gemeentelijke diensten', 'language': 'Dutch'}, {'query': 'Execution of work order by municipal services', 'language': 'English'}, {'query': ""Exécution de l'ordre de travail par les services municipaux"", 'language': 'French'}, {'query': 'Besluitvorming Schepencollege Kortemark', 'language': 'Dutch'}, {'query': 'Decision-making by the College of Aldermen Kortemark', 'language': 'English'}, {'query': 'Prise de décision par le Collège des échevins Kortemark', 'language': 'French'}]"
data/bpmn/rijbewijs.bpmn,"['rijbewijs', 'aanvraag', 'inwoner', 'wetgeving', 'tijdelijk verval', 'politie', 'rechtbank', 'voorlopig rijbewijs', 'internationaal rijbewijs', 'medische schifting', 'begeleider', 'Mercurius', 'ZETES', 'FOD Mobiliteit', 'rijverbod', 'herstelonderzoeken', 'categorieën', 'rijexamen', 'rijbewijs aanvragen', 'rijbewijs vernieuwen']","Het proces beschrijft de stappen die een inwoner van Aalter moet volgen om een rijbewijs aan te vragen, te vernieuwen of om te wisselen, inclusief voorlopige en internationale rijbewijzen. Het omvat de controle van de aanvraagdocumenten, betalingen, medische schifting, en de communicatie met de burger over de status van de aanvraag. Ook worden de voorwaarden voor begeleiders en de afhandeling van tijdelijke rijverboden en herstelonderzoeken beschreven. Het proces maakt gebruik van het programma Mercurius en de diensten van ZETES voor de productie van rijbewijzen.","[{'query': 'proces voor aanvragen van een rijbewijs in Aalter', 'language': 'Dutch'}, {'query': 'process for applying for a driving license in Aalter', 'language': 'English'}, {'query': 'processus de demande de permis de conduire à Aalter', 'language': 'French'}, {'query': 'stappenplan vernieuwing rijbewijs na tijdelijk verval', 'language': 'Dutch'}, {'query': 'step-by-step plan for renewing a driving license after temporary suspension', 'language': 'English'}, {'query': ""plan par étapes pour le renouvellement d'un permis de conduire après suspension temporaire"", 'language': 'French'}, {'query': 'aanvraagprocedure internationaal rijbewijs Belgisch burger', 'language': 'Dutch'}, {'query': 'application procedure for international driving license Belgian citizen', 'language': 'English'}, {'query': 'procédure de demande de permis de conduire international citoyen belge', 'language': 'French'}, {'query': 'gebruik van Mercurius systeem bij rijbewijsaanvraag', 'language': 'Dutch'}, {'query': 'use of Mercurius system in driving license application', 'language': 'English'}, {'query': 'utilisation du système Mercurius dans la demande de permis de conduire', 'language': 'French'}, {'query': 'rol van ZETES bij productie van rijbewijzen', 'language': 'Dutch'}, {'query': 'role of ZETES in the production of driving licenses', 'language': 'English'}, {'query': 'rôle de ZETES dans la production de permis de conduire', 'language': 'French'}, {'query': 'voorwaarden voor begeleiders bij voorlopig rijbewijs', 'language': 'Dutch'}, {'query': 'conditions for supervisors with a provisional driving license', 'language': 'English'}, {'query': 'conditions pour les accompagnateurs avec un permis de conduire provisoire', 'language': 'French'}, {'query': 'afhandeling van rijverboden en herstelonderzoeken', 'language': 'Dutch'}, {'query': 'handling of driving bans and recovery investigations', 'language': 'English'}, {'query': 'traitement des interdictions de conduire et des enquêtes de rétablissement', 'language': 'French'}, {'query': 'medische schifting bij aanvraag rijbewijs categorieën groep 2', 'language': 'Dutch'}, {'query': 'medical selection in application for driving license categories group 2', 'language': 'English'}, {'query': 'sélection médicale dans la demande de permis de conduire catégories groupe 2', 'language': 'French'}]"
data/bpmn/Sport-Subsidieaanvraag-De-Panne_v0.1.bpmn,"['Sport-Subsidieaanvraag', 'De Panne', 'Financiële dienst', 'Gemeenteraad', 'Subsidieaanvraag', 'Sportdienst', 'Beleidssubsidie', 'Impulssubsidie', 'Sportverenigingen', 'Uitbetaling']","Het proces beschrijft de stappen voor het aanvragen, evalueren en uitbetalen van subsidies aan sportverenigingen door de gemeente De Panne. Het omvat de communicatie tussen de sportdienst, de financiële dienst, de gemeenteraad en de sportverenigingen. De aanvraagprocedure omvat het invullen van beleids- en impulssubsidies, de evaluatie van de dossiers, de verdeling van de subsidiebedragen en de uiteindelijke uitbetaling na goedkeuring.","[{'query': 'Subsidieaanvraag proces voor sportverenigingen in De Panne', 'language': 'Dutch'}, {'query': 'Subsidy application process for sports associations in De Panne', 'language': 'English'}, {'query': 'Processus de demande de subvention pour les associations sportives à De Panne', 'language': 'French'}, {'query': 'Evaluatie en uitbetaling van sportsubsidies gemeente De Panne', 'language': 'Dutch'}, {'query': 'Evaluation and payment of sports subsidies municipality De Panne', 'language': 'English'}, {'query': 'Évaluation et paiement des subventions sportives municipalité De Panne', 'language': 'French'}, {'query': 'BPMN diagram van subsidieproces voor sportdienst De Panne', 'language': 'Dutch'}, {'query': 'BPMN diagram of subsidy process for sports service De Panne', 'language': 'English'}, {'query': 'Diagramme BPMN du processus de subvention pour le service des sports De Panne', 'language': 'French'}, {'query': 'Stappenplan voor beleidssubsidie en impulssubsidie aanvragen', 'language': 'Dutch'}, {'query': 'Step-by-step plan for applying for policy subsidy and impulse subsidy', 'language': 'English'}, {'query': ""Plan étape par étape pour demander une subvention de politique et une subvention d'impulsion"", 'language': 'French'}, {'query': 'Rol van gemeenteraad in subsidieaanvraag sportverenigingen', 'language': 'Dutch'}, {'query': 'Role of the municipal council in subsidy application for sports associations', 'language': 'English'}, {'query': 'Rôle du conseil municipal dans la demande de subvention pour les associations sportives', 'language': 'French'}, {'query': 'Uitbetalingsproces van sportsubsidies na goedkeuring', 'language': 'Dutch'}, {'query': 'Payment process of sports subsidies after approval', 'language': 'English'}, {'query': 'Processus de paiement des subventions sportives après approbation', 'language': 'French'}, {'query': 'Communicatieproces tussen sportdienst en verenigingen', 'language': 'Dutch'}, {'query': 'Communication process between sports service and associations', 'language': 'English'}, {'query': 'Processus de communication entre le service des sports et les associations', 'language': 'French'}, {'query': 'BPMN voorbeeld van subsidieverdeling in gemeente', 'language': 'Dutch'}, {'query': 'BPMN example of subsidy distribution in a municipality', 'language': 'English'}, {'query': 'Exemple BPMN de distribution de subventions dans une municipalité', 'language': 'French'}]"
data/bpmn/Sport-Subsidieaanvraag-GrootstGemeneDeler_v0.3.bpmn,"['Sport-Subsidieaanvraag', 'Financiële dienst', 'Schepencollege', 'Sportdienst', 'Evaluatie', 'Subsidiebedragen', 'Werkgroep', 'Sportraad', 'Jeugd', 'Uitbetaling']","Het proces beschrijft de stappen voor het aanvragen, evalueren en uitbetalen van subsidies aan sportverenigingen. Het omvat communicatie tussen de vereniging, sportdienst, en het schepencollege. Het proces bevat ook de evaluatie van dossiers, de telling van punten, de verdeling van subsidiebedragen, en de uiteindelijke goedkeuring en uitbetaling van subsidies.","[{'query': 'Subsidieaanvraag proces voor sportverenigingen', 'language': 'Dutch'}, {'query': 'Subsidy application process for sports associations', 'language': 'English'}, {'query': 'Processus de demande de subvention pour les associations sportives', 'language': 'French'}, {'query': 'Evaluatie van sportsubsidies', 'language': 'Dutch'}, {'query': 'Evaluation of sports subsidies', 'language': 'English'}, {'query': 'Évaluation des subventions sportives', 'language': 'French'}, {'query': 'Punten telling en subsidieverdeling', 'language': 'Dutch'}, {'query': 'Points counting and subsidy distribution', 'language': 'English'}, {'query': 'Comptage des points et distribution des subventions', 'language': 'French'}, {'query': 'Werkgroep met sportraad BPMN', 'language': 'Dutch'}, {'query': 'Working group with sports council BPMN', 'language': 'English'}, {'query': 'Groupe de travail avec conseil sportif BPMN', 'language': 'French'}, {'query': 'Uitbetalingsproces aan sportverenigingen', 'language': 'Dutch'}, {'query': 'Payment process to sports associations', 'language': 'English'}, {'query': 'Processus de paiement aux associations sportives', 'language': 'French'}, {'query': 'Goedkeuringsproces subsidieaanvragen', 'language': 'Dutch'}, {'query': 'Approval process for subsidy applications', 'language': 'English'}, {'query': ""Processus d'approbation des demandes de subvention"", 'language': 'French'}, {'query': 'Opmaak agenda voor schepencollege', 'language': 'Dutch'}, {'query': 'Preparation of the agenda for the executive council', 'language': 'English'}, {'query': ""Préparation de l'ordre du jour pour le collège échevinal"", 'language': 'French'}, {'query': 'Invullen werkingssubsidie sportvereniging', 'language': 'Dutch'}, {'query': 'Filling in operational subsidy for sports association', 'language': 'English'}, {'query': ""Remplissage de la subvention de fonctionnement pour l'association sportive"", 'language': 'French'}]"
